0,1
Tech expert reveals Ga. voting machines connected to Chinese vendor https://t.co/jAV5iC4SrR  - @politic_talks #politics #politic,politic
"RT @nuvolanevicata: https://t.co/Bak0EwhPOA
Land grabbing is one of the worst crimes of our time, it causes death and disease, it destroys…",politic
The latest AZ News To Use! https://t.co/DTeWyvetHj #politics #politic,politic
Witnesses in Ga. say Democrats altered military ballots https://t.co/Cq0Ojz42aK  - @politic_talks #politics #politic,politic
McConnell moves to vote on override of President Trump’s veto of NDAA https://t.co/T0kdKfQMyB  - @politic_talks #politics #politic,politic
15-year-old boy arrested in connection with NYC bicycle attack https://t.co/SMqkRZdTeO  - @politic_talks #politics #politic,politic
Ariz. citizens hold press conference on voter fraud https://t.co/t7GBdF3lY5  - @politic_talks #politics #politic,politic
America braces for possible eviction crisis https://t.co/B6PLPLonMO  - @politic_talks #politics #politic,politic
Hacked documents detail China’s effort to control narrative surrounding coronavirus outbreak https://t.co/vvQ7uZ9di4  - @politic_talks #politics #politic,politic
McConnell moves to vote on override of President Trump’s veto of NDAA https://t.co/q8cU8MBq4s  - @politic_talks #politics #politic,politic
Venezuela Supreme Court rules against extending parliamentary term by another year https://t.co/UE0hTebd7O  - @politic_talks #politics #politic,politic
"Hostile crowd gathers in Minneapolis after felony suspect shot, killed in exchange of gunfire with police https://t.co/rk6B6cpHnT  - @politic_talks #politics #politic",politic
"Police evict Antifa who bum-rushed motel in Tacoma, Wash. https://t.co/8Mo2zNQkSt  - @politic_talks #politics #politic",politic
Tornado damages over a dozen mobile homes in Texas https://t.co/2KnZ534XNr  - @politic_talks #politics #politic,politic
"True Thompson Looks So Grown Up in Khloe Kardashian's Adorable New Pic - E! Online
#worldnews #breakingnews #latestnews #politic...
https://t.co/X4vfRXH7Eq",politic
#Nationality of people is not #optional why #Iranian banned to have access to premium service of #LinkedIn ? In plain word it’s against #human_right &amp; somehow #racist (FYI: people are not belong to #government &amp; #politic),politic
#Nationality of people is not #optional why #Iranian banned to have access to premium service of #LinkedIn ? In plain word it’s against #human_right &amp; somehow #racist (FYI: people are not belong to #government &amp; #politic) https://t.co/os7cIVdqZc,politic
"Cuban refugees block Mexico-U.S. crossing, ask for asylum https://t.co/RtRffiikzE  - @politic_talks #politics #politic",politic
List of GOP lawmakers to object during electoral college certification process grows https://t.co/OeMBnE4oyd  - @politic_talks #politics #politic,politic
Dozens unaccounted for after landslide in Norway https://t.co/mcW9R3MJmr  - @politic_talks #politics #politic,politic
Calif. officials claim 0% ICU availability despite many counties reporting open hospital beds https://t.co/hyUndI3T8J  - @politic_talks #politics #politic,politic
Calif. Gov. Newsom announces $2B plan to reopen schools by spring https://t.co/hqAcUPejvr  - @politic_talks #politics #politic,politic
"DOJ Adviser Lott: Trump votes subtracted, Biden votes inflated https://t.co/tg4m82rFde  - @politic_talks #politics #politic",politic
Tech expert confirms voting machines connected to internet while testifying before GA. senate subcommittee on elections https://t.co/9KTtQ7niUz  - @politic_talks #politics #politic,politic
GOP chairwoman blames Dems for peoples’ lack of trust in COVID-19 vaccine https://t.co/jl4ZnluPKM  - @politic_talks #politics #politic,politic
American Airlines restarts commercial Boeing 737 MAX flights https://t.co/Fg5omxCzhq  - @politic_talks #politics #politic,politic
Newt Gingrich backs President Trump’s push for $2K stimulus checks https://t.co/0dsEubPOtt  - @politic_talks #politics #politic,politic
Sen. Josh Hawley announces he will object during Electoral College certification process https://t.co/w1W4opuwpV  - @politic_talks #politics #politic,politic
Secy. Pompeo calls for release of Chinese citizen journalist https://t.co/iFo43aDklw  - @politic_talks #politics #politic,politic
CNN’S Jim Acosta admits to media bias against the President https://t.co/27sz2tU4x7  - @politic_talks #politics #politic,politic
"CBP, ICE release reports on border arrests, seizures https://t.co/O3iCpVrvJF  - @politic_talks #politics #politic",politic
Mich. Gov. Whitmer vetoes unemployment funds https://t.co/9dWyk7rEpZ  - @politic_talks #politics #politic,politic
Powell: Election fraud now obvious because President Trump’s landslide victory broke Dominion ‘vote-switch’ algorithm https://t.co/Me8qmh0n4j  - @politic_talks #politics #politic,politic
#DemocraticDebate #Politic #DemocracyParty #US #Oresident #JoeBiden denounces #CyberAttacks and #Illegal #OnLineActivity who attack our #privacy and #democracy  #DemocracyLivesMatter https://t.co/QOP42EbhMf,politic
Stay-at-home orders extended in parts of Calif. https://t.co/PnwlelxrLU  - @politic_talks #politics #politic,politic
Ga. citizens launch grand jury petition to probe election fraud https://t.co/1aFL2hoqPh  - @politic_talks #politics #politic,politic
FBI investigating ‘suspicious’ fire at black church in Mass. https://t.co/o1ob2CWkpR  - @politic_talks #politics #politic,politic
Mo. woman shot after allegedly trying to hit officer with car https://t.co/QZLN1dSrpt  - @politic_talks #politics #politic,politic
Republicans divided over NDAA as both chambers move to override President Trump’s veto https://t.co/aVqaiEWCGc  - @politic_talks #politics #politic,politic
McConnell introduces competing bill for $2K stimulus checks https://t.co/QLyIUdertI  - @politic_talks #politics #politic,politic
Putin regime arrests monk who called for political change https://t.co/tBk02ScELX  - @politic_talks #politics #politic,politic
Calif. sex offenders may get early parole https://t.co/3s5Ce6Elk9  - @politic_talks #politics #politic,politic
Facebook posts by Mich. mayor spark controversy in town https://t.co/9YkEV9AWH5  - @politic_talks #politics #politic,politic
6.4 magnitude earthquake strikes Croatia https://t.co/Hi33HMuCHJ  - @politic_talks #politics #politic,politic
Portland sees record shootings after mayor disbands Gun Violence Reduction Team https://t.co/3f91XNhboj  - @politic_talks #politics #politic,politic
N.Y. gov. announces executive order on vaccine fraud crackdown https://t.co/CoBawl9RKp  - @politic_talks #politics #politic,politic
China rejects U.S. calls to release Hong Kong fugitives https://t.co/2QJ5zehBCx  - @politic_talks #politics #politic,politic
"The phenomenon of always wanting and asking for more is like loosing a lifetime of happiness, for a moment of pleasure...
A consuming behavioural which we ought to change.
""Demonstration effect"", James Duesenberry
#publicfinance #effetdecliquet #consumation #economy #politic",politic
Breonna Taylor statue smashed in Northern Calif. https://t.co/KCZfaqaYxw  - @politic_talks #politics #politic,politic
Poll: President Trump most admired man 2020 https://t.co/6ZSafmxna0  - @politic_talks #politics #politic,politic
Analyst finds irregularities in Pa. voter registry https://t.co/zGLqkENvkj  - @politic_talks #politics #politic,politic
Fmr. camper details abuse at camp overseen by Raphael Warnock https://t.co/t5yy7RSx9h  - @politic_talks #politics #politic,politic
Neighbor Describes Conversation With Nashville Bomber: ‘He was a recluse’ https://t.co/tzc9CalVJg  - @politic_talks #politics #politic,politic
Rep. Andy Biggs: NDAA veto override a crying shame https://t.co/LKadZtnsqk  - @politic_talks #politics #politic,politic
"Covid 'might not be the “big one” and there might be even worse pandemics to come'
#worldnews #breakingnews #latestnews #politic...
https://t.co/TZwrpIEoXP",politic
"House votes to increase stimulus checks to $2K, bill now heads to Senate for vote https://t.co/RVMUiEcxvY  - @politic_talks #politics #politic",politic
"John Travolta Shares Sweet Christmas Video After Kelly Preston's Death - E! Online
#worldnews #breakingnews #latestnews #politic...
https://t.co/ccoJ6s0drV",politic
1.7T omnibus bill faces backlash for wasteful spending https://t.co/2sbqv8Hdj2  - @politic_talks #politics #politic,politic
White House Press Secy. slams CNN’s Jake Tapper for baseless personal attacks https://t.co/FYdvkqcziC  - @politic_talks #politics #politic,politic
U.S. omnibus spending package angers China https://t.co/XFq2Q1EobV  - @politic_talks #politics #politic,politic
NYPD officers face increasing terror threats https://t.co/xKlHyG8gqI  - @politic_talks #politics #politic,politic
U.S. serviceman charged in Ill. bowling alley shooting https://t.co/88Fdu3mpYy  - @politic_talks #politics #politic,politic
Adm. Brett Grior: Vaccine likely effective against COVID-19 variant https://t.co/wnaYAvudrl  - @politic_talks #politics #politic,politic
Possible motive behind Nashville bombing is 5G conspiracy theories https://t.co/oxmOhQQQI9  - @politic_talks #politics #politic,politic
Some GOP Senators prepare to reject Electoral College vote count on Jan. 6 https://t.co/LsjHW4VZXF  - @politic_talks #politics #politic,politic
President Trump signs massive $2.3T govt. spending bill https://t.co/giNWd3KbO2  - @politic_talks #politics #politic,politic
"I don't need SEX the government fucks me everyday 
Classic T-Shirt

#ShopNow @ https://t.co/f2FoevImDC 

#government #funny #T_Shirt #politic #politics #creative #fun #politics #political https://t.co/EtInnuprr8",politic
"Microsoft's TikTok quote turned down, PS5 digital display coming Wednesday - Video
#worldnews #breakingnews #latestnews #politic...
https://t.co/zYc91SWAmK",politic
"Facebook Messenger will let you see videos together with your family and friends
#worldnews #breakingnews #latestnews #politic...
https://t.co/9CJ4gNkR1l",politic
Chicago restaurant owner awarded $15K grant https://t.co/xarq3AL5qs  - @politic_talks #politics #politic,politic
Surgeon Gen. Adams calls out medical racism amid pandemic https://t.co/iMy1DGmeFB  - @politic_talks #politics #politic,politic
Dem. Rep-elects dodge question on Pelosi speaker support https://t.co/5SlQXrpvAp  - @politic_talks #politics #politic,politic
‘Oceans Asia’: 1.56B face masks will enter oceans in 2020 https://t.co/rTtAKn7DhZ  - @politic_talks #politics #politic,politic
"Kylie Jenner's Daughter Stormi Steals the Show in Cute Christmas Video - E! Online
#worldnews #breakingnews #latestnews #politic...
https://t.co/wpLCsbBV5c",politic
Nashville PD describe Christmas Day explosion https://t.co/8eSmVRJB60  - @politic_talks #politics #politic,politic
"Despite strict lockdowns in Calif., COVID-19 cases are higher than ever https://t.co/BeUUELG2LF  - @politic_talks #politics #politic",politic
Music video shooting in Mass. leaves 1 killed and 5 injured https://t.co/WUHh0ttmMh  - @politic_talks #politics #politic,politic
Central England under flood warnings after ‘Storm Bella’ rainfall causes river overflow https://t.co/oJxVSaRn2I  - @politic_talks #politics #politic,politic
"President Trump lists ‘irrefutable proof’ of rigged election, says ‘time for Republican senators to step up and fight’ https://t.co/sPKZY98zAk  - @politic_talks #politics #politic",politic
"What’s coming in January 2021
#Realdeepdivepodcast #laverdad #historia #history #gente #people #politica #politic #teinvito #openyoureyes #openyourmind https://t.co/Ri0jgGaOki",politic
Authorities search Nashville home of possible person of interest after Christmas day explosion https://t.co/FsBdWxVXZW  - @politic_talks #politics #politic,politic
"Candace Cameron Bure Denies Attending Kirk Cameron's Caroling Protests - E! Online
#worldnews #breakingnews #latestnews #politic...
https://t.co/7M93v9NVPL",politic
CARES Act unemployment benefits set to expire today https://t.co/0AnlO6JOsa  - @politic_talks #politics #politic,politic
Israel expecting Moroccan delegation amid new relations https://t.co/5RSK6gUQDN  - @politic_talks #politics #politic,politic
Conflict rises in Washington over stimulus price tag https://t.co/UNGQOHHxUf  - @politic_talks #politics #politic,politic
NYPD officer saved by bulletproof released from hospital https://t.co/8Jj6XrB6SZ  - @politic_talks #politics #politic,politic
Moore: Not sure we need massive stimulus bill https://t.co/nFHGghKsPo  - @politic_talks #politics #politic,politic
"RT @nuvolanevicata: https://t.co/JwfvA4p3fg
New tokenized artwork with @superrare.co 

Metaphor of power crushing workers 
#cryptoartmarket…",politic
"https://t.co/JwfvA4p3fg
New tokenized artwork with @superrare.co 

Metaphor of power crushing workers 
#cryptoartmarketplace #cryptoart #cryptoartwork #cryptoartinvestment #artonsale #eth #cryptoart #politic #capitalism #money #gain #working_class https://t.co/fig6tMTjQy",politic
20 states raise minimum wage at start of New Year https://t.co/D1Iitz8AE7  - @politic_talks #politics #politic,politic
FBI investigating Nashville bombing suspect’s contacts before attack https://t.co/WUFRz03EhC  - @politic_talks #politics #politic,politic
Report: U.S. sees highest surge in homicides during 2020 https://t.co/IoPutpDkc9  - @politic_talks #politics #politic,politic
Ronna McDaniel: Hold the line against Dem anti-police agenda https://t.co/HAr13rupeJ  - @politic_talks #politics #politic,politic
Come on. This us a #politic #DRAMA Can we kindly #work to make it #less #personal? https://t.co/tnr4yJ6cDV,politic
#People in Iraq say No to US military. #politic https://t.co/7Arqs85lwK,politic
"And there comes a time when one must take a position that is neither #safe, nor #politic, nor #popular but he must take it because #conscience tells him it is #right.
Martin Luther King Jr. (1929-1968)",politic
"Portland, Ore. mayor vows to end antifa violence https://t.co/2ZDE90BL7l  - @politic_talks #politics #politic",politic
Rep.-elect Lauren Boebert: I am my own security https://t.co/tXuOgaRX4N  - @politic_talks #politics #politic,politic
"New Puerto Rico gov. sworn in, vows to push statehood https://t.co/O7jkpyQaum  - @politic_talks #politics #politic",politic
Elon Musk: Tesla self-driving is safer for all https://t.co/zvSXa2fL5n  - @politic_talks #politics #politic,politic
Report: Chicago homicides and shootings surged in 2020 https://t.co/6a8Dlo7y2D  - @politic_talks #politics #politic,politic
Texas Supreme Court sides with AG in fight to keep restaurants open https://t.co/maZ6RuNIN2  - @politic_talks #politics #politic,politic
President Trump: Fox News is not watchable https://t.co/RnnQhJ7zRk  - @politic_talks #politics #politic,politic
Democrat Rep. Jones supports Ga. Republican Senate candidates https://t.co/1Wm4w9NoNW  - @politic_talks #politics #politic,politic
House Dems propose new rules for upcoming year in Congress https://t.co/j6ud2KdeLK  - @politic_talks #politics #politic,politic
Iran says it plans to increase Uranium enrichment to 20% https://t.co/6lY5v4zZbG  - @politic_talks #politics #politic,politic
Runbeck Election Systems Teamed Up with Dominion Voting Systems in Georgia Election -- Pallets of Company's Ballots Found in Fulton County Warehouse https://t.co/2MUCQWPvbj via @gatewaypundit #Georgia #GOP #StopTheSteal #DemocracyWins #WeThePeople need answers not “#Politic-talk”,politic
Kidnapped Texas mother of two found safe in Ill. https://t.co/t6MELG6XEX  - @politic_talks #politics #politic,politic
NYC sees first homicide within first hours of New Year https://t.co/cfXQdnAvDD  - @politic_talks #politics #politic,politic
President Trump continues to push for a deeper look into 2020 election https://t.co/mZR1ycu6dc  - @politic_talks #politics #politic,politic
"Vietnam actively pursues defence diplomacy in peace time for national development: Defence official
https://t.co/7mRn4KR1sA

#vietnam #vtvworld #defence #diplomacy #army #soldier #un #peace #peacekeeping #bluehat #politic #political #national #save #guard #war",politic
Senate votes to override the President’s veto on Defense Bill https://t.co/DlkGlbkuNf  - @politic_talks #politics #politic,politic
"Not gonna use these hashtags anymore though

#A1
#clash
#flowers
#jade west
#kawaii - cute drawing
#lit
#MLBB
#neko
#politic
#rap
#tatts
#weapons",politic
"The saddest thing about The Gambia is that, every day the needs of honest citizens are put second to greed and personal gain. Every day the Gambia sinks deeper, it's a pity and I wish we could fight together to change that. 
#Gambia #Government #citizenfirst #development #Politic https://t.co/EbiSey93uo",politic
More GOP senators object vote on $2K stimulus checks https://t.co/VJAZWbDt9s  - @politic_talks #politics #politic,politic
"Demonstration turns into demolition in Portland, Ore. https://t.co/fMeKa71KtL  - @politic_talks #politics #politic",politic
President Trump extends restrictions on foreign work visas https://t.co/xAtEQhFgz5  - @politic_talks #politics #politic,politic
Wis. pharmacist accused of tampering with 570 vaccine doses https://t.co/FSnyYLDT6W  - @politic_talks #politics #politic,politic
VP Pence: Election results are not up to me https://t.co/xzkstwYRR7  - @politic_talks #politics #politic,politic
"N.Y. restaurants sue to reopen, point to low infection risk from indoor dining https://t.co/ngErfKSupU  - @politic_talks #politics #politic",politic
Tech expert reveals Ga. voting machines connected to Chinese vendor https://t.co/jAV5iC4SrR  - @politic_talks #politics #politic,politic
"RT @nuvolanevicata: https://t.co/Bak0EwhPOA
Land grabbing is one of the worst crimes of our time, it causes death and disease, it destroys…",politic
The latest AZ News To Use! https://t.co/DTeWyvetHj #politics #politic,politic
Witnesses in Ga. say Democrats altered military ballots https://t.co/Cq0Ojz42aK  - @politic_talks #politics #politic,politic
McConnell moves to vote on override of President Trump’s veto of NDAA https://t.co/T0kdKfQMyB  - @politic_talks #politics #politic,politic
15-year-old boy arrested in connection with NYC bicycle attack https://t.co/SMqkRZdTeO  - @politic_talks #politics #politic,politic
Ariz. citizens hold press conference on voter fraud https://t.co/t7GBdF3lY5  - @politic_talks #politics #politic,politic
America braces for possible eviction crisis https://t.co/B6PLPLonMO  - @politic_talks #politics #politic,politic
Hacked documents detail China’s effort to control narrative surrounding coronavirus outbreak https://t.co/vvQ7uZ9di4  - @politic_talks #politics #politic,politic
McConnell moves to vote on override of President Trump’s veto of NDAA https://t.co/q8cU8MBq4s  - @politic_talks #politics #politic,politic
Venezuela Supreme Court rules against extending parliamentary term by another year https://t.co/UE0hTebd7O  - @politic_talks #politics #politic,politic
"Hostile crowd gathers in Minneapolis after felony suspect shot, killed in exchange of gunfire with police https://t.co/rk6B6cpHnT  - @politic_talks #politics #politic",politic
"Police evict Antifa who bum-rushed motel in Tacoma, Wash. https://t.co/8Mo2zNQkSt  - @politic_talks #politics #politic",politic
Tornado damages over a dozen mobile homes in Texas https://t.co/2KnZ534XNr  - @politic_talks #politics #politic,politic
"True Thompson Looks So Grown Up in Khloe Kardashian's Adorable New Pic - E! Online
#worldnews #breakingnews #latestnews #politic...
https://t.co/X4vfRXH7Eq",politic
#Nationality of people is not #optional why #Iranian banned to have access to premium service of #LinkedIn ? In plain word it’s against #human_right &amp; somehow #racist (FYI: people are not belong to #government &amp; #politic),politic
#Nationality of people is not #optional why #Iranian banned to have access to premium service of #LinkedIn ? In plain word it’s against #human_right &amp; somehow #racist (FYI: people are not belong to #government &amp; #politic) https://t.co/os7cIVdqZc,politic
"Cuban refugees block Mexico-U.S. crossing, ask for asylum https://t.co/RtRffiikzE  - @politic_talks #politics #politic",politic
List of GOP lawmakers to object during electoral college certification process grows https://t.co/OeMBnE4oyd  - @politic_talks #politics #politic,politic
Dozens unaccounted for after landslide in Norway https://t.co/mcW9R3MJmr  - @politic_talks #politics #politic,politic
Calif. officials claim 0% ICU availability despite many counties reporting open hospital beds https://t.co/hyUndI3T8J  - @politic_talks #politics #politic,politic
Calif. Gov. Newsom announces $2B plan to reopen schools by spring https://t.co/hqAcUPejvr  - @politic_talks #politics #politic,politic
"DOJ Adviser Lott: Trump votes subtracted, Biden votes inflated https://t.co/tg4m82rFde  - @politic_talks #politics #politic",politic
Tech expert confirms voting machines connected to internet while testifying before GA. senate subcommittee on elections https://t.co/9KTtQ7niUz  - @politic_talks #politics #politic,politic
GOP chairwoman blames Dems for peoples’ lack of trust in COVID-19 vaccine https://t.co/jl4ZnluPKM  - @politic_talks #politics #politic,politic
American Airlines restarts commercial Boeing 737 MAX flights https://t.co/Fg5omxCzhq  - @politic_talks #politics #politic,politic
Newt Gingrich backs President Trump’s push for $2K stimulus checks https://t.co/0dsEubPOtt  - @politic_talks #politics #politic,politic
Sen. Josh Hawley announces he will object during Electoral College certification process https://t.co/w1W4opuwpV  - @politic_talks #politics #politic,politic
Secy. Pompeo calls for release of Chinese citizen journalist https://t.co/iFo43aDklw  - @politic_talks #politics #politic,politic
CNN’S Jim Acosta admits to media bias against the President https://t.co/27sz2tU4x7  - @politic_talks #politics #politic,politic
"CBP, ICE release reports on border arrests, seizures https://t.co/O3iCpVrvJF  - @politic_talks #politics #politic",politic
Mich. Gov. Whitmer vetoes unemployment funds https://t.co/9dWyk7rEpZ  - @politic_talks #politics #politic,politic
Powell: Election fraud now obvious because President Trump’s landslide victory broke Dominion ‘vote-switch’ algorithm https://t.co/Me8qmh0n4j  - @politic_talks #politics #politic,politic
#DemocraticDebate #Politic #DemocracyParty #US #Oresident #JoeBiden denounces #CyberAttacks and #Illegal #OnLineActivity who attack our #privacy and #democracy  #DemocracyLivesMatter https://t.co/QOP42EbhMf,politic
Stay-at-home orders extended in parts of Calif. https://t.co/PnwlelxrLU  - @politic_talks #politics #politic,politic
Ga. citizens launch grand jury petition to probe election fraud https://t.co/1aFL2hoqPh  - @politic_talks #politics #politic,politic
FBI investigating ‘suspicious’ fire at black church in Mass. https://t.co/o1ob2CWkpR  - @politic_talks #politics #politic,politic
Mo. woman shot after allegedly trying to hit officer with car https://t.co/QZLN1dSrpt  - @politic_talks #politics #politic,politic
Republicans divided over NDAA as both chambers move to override President Trump’s veto https://t.co/aVqaiEWCGc  - @politic_talks #politics #politic,politic
McConnell introduces competing bill for $2K stimulus checks https://t.co/QLyIUdertI  - @politic_talks #politics #politic,politic
Putin regime arrests monk who called for political change https://t.co/tBk02ScELX  - @politic_talks #politics #politic,politic
Calif. sex offenders may get early parole https://t.co/3s5Ce6Elk9  - @politic_talks #politics #politic,politic
Facebook posts by Mich. mayor spark controversy in town https://t.co/9YkEV9AWH5  - @politic_talks #politics #politic,politic
6.4 magnitude earthquake strikes Croatia https://t.co/Hi33HMuCHJ  - @politic_talks #politics #politic,politic
Portland sees record shootings after mayor disbands Gun Violence Reduction Team https://t.co/3f91XNhboj  - @politic_talks #politics #politic,politic
N.Y. gov. announces executive order on vaccine fraud crackdown https://t.co/CoBawl9RKp  - @politic_talks #politics #politic,politic
China rejects U.S. calls to release Hong Kong fugitives https://t.co/2QJ5zehBCx  - @politic_talks #politics #politic,politic
"The phenomenon of always wanting and asking for more is like loosing a lifetime of happiness, for a moment of pleasure...
A consuming behavioural which we ought to change.
""Demonstration effect"", James Duesenberry
#publicfinance #effetdecliquet #consumation #economy #politic",politic
Breonna Taylor statue smashed in Northern Calif. https://t.co/KCZfaqaYxw  - @politic_talks #politics #politic,politic
Poll: President Trump most admired man 2020 https://t.co/6ZSafmxna0  - @politic_talks #politics #politic,politic
Analyst finds irregularities in Pa. voter registry https://t.co/zGLqkENvkj  - @politic_talks #politics #politic,politic
Fmr. camper details abuse at camp overseen by Raphael Warnock https://t.co/t5yy7RSx9h  - @politic_talks #politics #politic,politic
Neighbor Describes Conversation With Nashville Bomber: ‘He was a recluse’ https://t.co/tzc9CalVJg  - @politic_talks #politics #politic,politic
Rep. Andy Biggs: NDAA veto override a crying shame https://t.co/LKadZtnsqk  - @politic_talks #politics #politic,politic
"Covid 'might not be the “big one” and there might be even worse pandemics to come'
#worldnews #breakingnews #latestnews #politic...
https://t.co/TZwrpIEoXP",politic
"House votes to increase stimulus checks to $2K, bill now heads to Senate for vote https://t.co/RVMUiEcxvY  - @politic_talks #politics #politic",politic
"John Travolta Shares Sweet Christmas Video After Kelly Preston's Death - E! Online
#worldnews #breakingnews #latestnews #politic...
https://t.co/ccoJ6s0drV",politic
1.7T omnibus bill faces backlash for wasteful spending https://t.co/2sbqv8Hdj2  - @politic_talks #politics #politic,politic
